id,type,name,sequence,dna,code,description,reference
6xHis,seq,6xHis,HHHHHH,,,,
TEV_site,seq,TEV site,ENLYFQG,,,Cleavage tag for the TEV protease (cleaves between Gln and Ser),
ALFA_tag,seq,ALFA-tag,SRLEEELRRRLTE,,,Helical peptide tag for recognition by a repertoire of antibodies,
AviTag,seq,AviTag,GLNDIFEAQKIEWHE,,,For biotinylation by BirA and streptavidin isolation,
C_tag,seq,C-tag,EPEA,,,,
Calmodulin_tag,seq,Calmodulin-tag,KRRWKKNFIAVSAANRFKKISSSGAL,,,Calmodulin-binding peptide (CBP),
Polyglutamate_tag,seq,Polyglutamate tag,EEEEEE,,,,
E_tag,seq,E-tag,GAPVPYPDPLEPR,,,Recognized by an antibody,
FLAG_tag,seq,FLAG-tag,DYKDDDDK,,,Recognized by an antibody,
HA_tag,seq,HA-tag,YPYDVPDYA,,,Recognized by an antibody,
Myc_tag,seq,Myc-tag,EQKLISEEDL,,,Recognized by an antibody,
NE_tag,seq,NE-tag,TKENPRSNQEESYDDNES,,,Recognized by an antibody,
Rho1D4_tag,seq,Rho1D4-tag,TETSQVAPA,,,For purification of membrane proteins,
S_tag,seq,S-tag,KETAAAKFERQHMDS,,,,
SBP_tag,seq,SBP-tag,MDEKTTGWRGGHVVEGLAGELEQLRARLEHHPQGQREP,,,Binds to streptavidin,
Softag_1,seq,Softag 1,SLAELLNAGLGGS,,,,
Softag_3,seq,Softag 3,TQDPSRVG,,,,
Spot_tag,seq,Spot-tag,PDRVRAVSHWSS,,,Recognized by a nanobody,
Strep_tag,seq,Strep-tag,WSHPQFEK,,,Binds to streptavidin,
T7_tag,seq,T7-tag,MASMTGGQQMG,,,For affinity purification,
TC_tag,seq,TC tag,CCPGCC,,,Recognized by FlAsH and ReAsH biarsenical compounds,
Ty_tag ,seq,Ty tag ,EVHTNQDPLD,,,,
V5_tag,seq,V5 tag,GKPIPNPLLGLDST,,,Recognized by an antibody,
VSV_tag,seq,VSV-tag,YTDIEMNRLGK,,,Recognized by an antibody,
Xpress_tag ,seq,Xpress tag ,DLYDDDDK,,,,
Isopeptag,seq,Isopeptag,TDKDMTITFTNKKDAE,,,Binds covalently to pilin-C,
SpyTag,seq,SpyTag,AHIVMVDAYKPTK,,,Binds covalently to SpyCatcher,
SnoopTag,seq,SnoopTag,KLGDIEFIKVNK,,,Binds covalently to SnoopCatcher,
SnoopTagJr,seq,SnoopTagJr,KLGSIEFIKVNK,,,Binds to SnoopCatcher or DogTag,
DogTag,seq,DogTag,DIPATYEFTDGKHYITNEPIPPK,,,Binds to SnoopTagJr,
SdyTag,seq,SdyTag,DPIVMIDNDKPIT,,,Binds covalently to SdyCatcher,
Thrombin_site,seq,Thrombin site,LVPRGS,,,For thrombin (cleaves between Arg and Gly),
PreScission_site,seq,PreScission site,LEVLFQGP,,,For PreScission protease (cleaves between Gln and Gly),
TAP,seq,TAP,GRRIPGLINPWKRRWKKNFIAVSAANRFKKISSSGALDYDIPTTASENLYFQGEFGLAQHDEAVDNKFNKEQQNAFYEILHLPNLNEEQRNAFIQSLKDDPSQSANLLAEAKKLNDAQAPKVDNKFNKEQQNAFYEILHLPNLNEEQRNAFIQSLKDDPSQSANLLAEAKKLNDAQAPKVDANHQ ,,,"Tandem affinity purification (TAP) combination tag: calmodulin binding peptide (CBP), TEV site, and two ProtA IgG-binding domains",
TRX,seq,TRX,MSDKIIHLTDDSFDTDVLKADGAILVDFWAEWCGPCKMIAPILDEIADEYQGKLTVAKLNIDQNPGTAPKYGIRGIPTLLLFKNGEVAATKVGALSKGQLKEFLDANLAGSGSGHMHHHHHHSSGLVPRG ,,,Thioredoxin (TRX) tag assists in folding,
HiBiT,seq,HiBiT,VSGWRLFKKIS,,,Binds to LgBiT. The complex has luciferase activity.,
